2023-08-01,Business Analyst,Business / Analyst / Product,Công ty TNHH Công nghệ số Adamo,10 - 20 triệu,10000000.0,20000000.0,VND
2023-08-01,Nhân Viên Lập Trình Phần Mềm - Thu Nhập Từ 10 - 20 Triệu,Developer / Engineer,Công ty TNHH Đầu Tư Công Nghệ ST,10 - 20 triệu,10000000.0,20000000.0,VND
2023-08-01,.Net Developer (N3) | T9160,Developer / Engineer,Công ty TNHH CMC GLOBAL,thoả thuận,,,
2023-08-01,"Project Manager (Tiếng Anh Giao Tiếp, Từ 1 Năm Kinh Nghiệm)",Business / Analyst / Product,CÔNG TY CỔ PHẦN CÔNG NGHỆ SOTATEK,tới 35 triệu,,35000000.0,VND
2023-08-01,Devops/Sre - Chuyên Viên Quản Trị Hệ Thống/Automation,Developer / Engineer,Công ty Cổ phần Thời Trang Yody,tới 50 triệu,,50000000.0,VND
2023-08-01,Angularjs (Từ 1.5 Năm Kinh Nghiệm),Developer / Engineer,Công ty Cổ Phần Rikkeisoft,12 - 18 triệu,12000000.0,18000000.0,VND
2023-08-01,IT Application Support,IT Operations / DevOps / Support,Công ty TNHH Công nghệ và Giải pháp CMC Sài Gòn,thoả thuận,,,
2023-08-01,Thực Tập Sinh Lập Trình Viên .Net,Developer / Engineer,CÔNG TY TNHH CÔNG NGHỆ VÀ TRUYỀN THÔNG IIT,2 - 6 triệu,2000000.0,6000000.0,VND
2023-08-01,Chuyên Viên Lập Trình Phần Mềm,Developer / Engineer,Công ty cổ phần Công nghệ và Giải pháp Bình Minh,thoả thuận,,,
2023-08-01,Thực Tập Lập Trình Viên .Net,Developer / Engineer,CÔNG TY TNHH CÔNG NGHỆ VÀ TRUYỀN THÔNG IIT(IIT TECHCOM),3 - 6 triệu,3000000.0,6000000.0,VND
2023-08-01,Chuyên Viên Business Analyst,Business / Analyst / Product,Công ty cổ phần Công nghệ và Giải pháp Bình Minh,thoả thuận,,,
2023-08-01,AI Engineer,Developer / Engineer,FPT Software,thoả thuận,,,
2023-08-01,Senior Business Intelligence Analyst,Business / Analyst / Product,Công ty Cổ phần Giải pháp Công nghệ Bất động sản và Đầu tư RETI,"trên 1,000 usd",1000.0,,USD
2023-08-01,Full-Stack Developer,Developer / Engineer,FPT Software,thoả thuận,,,
2023-08-01,Senior Java Developer,Developer / Engineer,Mor Software HN,tới 50 triệu,,50000000.0,VND
2023-08-01,Business Development Executive,Developer / Engineer,Mor Software HN,10 - 30 triệu,10000000.0,30000000.0,VND
2023-08-01,Nhân Viên IT Helpdesk,IT Operations / DevOps / Support,CÔNG TY CỔ PHẦN GIÁO DỤC QUỐC TẾ VIỆT ÚC,9 - 10 triệu,9000000.0,10000000.0,VND
2023-08-01,IT Infra Lead,IT Operations / DevOps / Support,Công ty CP Minh Phương Logistics,thoả thuận,,,
2023-08-01,.Net Developer,Developer / Engineer,Công ty Cổ phần Eton,thoả thuận,,,
2023-08-01,Secretary - Salary Up To 15M,Other,FPT Software,thoả thuận,,,
2023-08-01,Embedded Software Engineer (Iot Project)_Up To $2800,Developer / Engineer,FPT Software,thoả thuận,,,
2023-08-01,Junior Developer (C/Embedded),Developer / Engineer,FPT Software,thoả thuận,,,
2023-08-01,Senior AI Engineer - Salary Up To $2500,Developer / Engineer,FPT Software,thoả thuận,,,
2023-08-01,Chuyên Gia Big Data,Developer / Engineer,CÔNG TY TNHH ALPHA BLOCK,tới 50 triệu,,50000000.0,VND
2023-08-01,Front End Developer,Developer / Engineer,Akila,thoả thuận,,,
2023-08-01,Backend Developer,Developer / Engineer,Akila,thoả thuận,,,
2023-08-01,Trưởng Nhóm Lập Trình Web,Developer / Engineer,Công ty TNHH giải pháp phần mềm BLACKWIND,30 - 35 triệu,30000000.0,35000000.0,VND
2023-08-01,Nhân Viên Lập Trình Mobile,Developer / Engineer,Công ty TNHH giải pháp phần mềm BLACKWIND,10 - 20 triệu,10000000.0,20000000.0,VND
2023-08-01,Nhân Viên Lập Trình Web,Developer / Engineer,Công ty TNHH giải pháp phần mềm BLACKWIND,10 - 20 triệu,10000000.0,20000000.0,VND
2023-08-01,Trưởng Bộ Phận Lập Trình Mobile,Developer / Engineer,Công ty TNHH giải pháp phần mềm BLACKWIND,30 - 35 triệu,30000000.0,35000000.0,VND
2023-08-01,Nhân Viên Triển Khai Phần Mềm,Developer / Engineer,Công ty TNHH giải pháp phần mềm BLACKWIND,8 - 12 triệu,8000000.0,12000000.0,VND
2023-08-01,Nhân Viên Tester Thu Nhập 9 Đến 12 Triệu,Tester / QA,Công ty TNHH giải pháp phần mềm BLACKWIND,9 - 12 triệu,9000000.0,12000000.0,VND
2023-08-01,System Admin,IT Operations / DevOps / Support,Công ty TNHH giải pháp phần mềm BLACKWIND,10 - 18 triệu,10000000.0,18000000.0,VND
2023-08-01,Middle-Up QA/Tester,Tester / QA,Sun* Inc. (Sun Asterisk Inc.),"600 - 1,300 usd",600.0,1300.0,USD
2023-08-01,Thực Tập Sinh Lập Trình Viên .Net,Developer / Engineer,CÔNG TY TNHH CÔNG NGHỆ VÀ TRUYỀN THÔNG IIT,3 - 8 triệu,3000000.0,8000000.0,VND
2023-08-01,Cộng Tác Viên IT,IT Operations / DevOps / Support,Công ty TNHH FSI Việt Nam,trên 3 triệu,3000000.0,,VND
2023-08-01,Senior Devops Engineers - Salary Upto 2000 Usd,Developer / Engineer,CÔNG TY TNHH GIẢI PHÁP ECR VIỆT NAM,"tới 2,000 usd",,2000.0,USD
2023-08-01,Project Manager,Business / Analyst / Product,CÔNG TY TNHH GIẢI PHÁP ECR VIỆT NAM,tới 40 triệu,,40000000.0,VND
2023-08-01,Devops Engineer,Developer / Engineer,Công ty Cổ phần Công nghệ KiotViet,20 - 30 triệu,20000000.0,30000000.0,VND
2023-08-01,Nhân Viên Web Designer (Html/Css + Wordpress),Designer / Creative,CÔNG TY TNHH VIETRY,thoả thuận,,,
2023-08-01,Marketing Communication,Other,CÔNG TY TNHH MESONEER,thoả thuận,,,
2023-08-01,Chuyên Viên Cao Cấp BI,Other,CÔNG TY TÀI CHÍNH TNHH MỘT THÀNH VIÊN BƯU ĐIỆN,thoả thuận,,,
2023-08-01,IT Business Analyst,Business / Analyst / Product,CÔNG TY TRÁCH NHIỆM HỮU HẠN CADENA VIỆT NAM,thoả thuận,,,
2023-08-01,Quản Lý Dự Án (Lĩnh Vực Công Nghệ Thông Tin),Developer / Engineer,Công ty cổ phần BDA.SC,trên 12 triệu,12000000.0,,VND
2023-08-01,Product Owner,Business / Analyst / Product,CÔNG TY CỔ PHẦN EMDDI,thoả thuận,,,
2023-08-01,Vuejs Developer - Không Yêu Cầu Tiếng Anh - Từ 2 Năm Kinh Nghiệm - Mức Lương Lên Tới 30 Triệu,Developer / Engineer,CÔNG TY CỔ PHẦN LOTUS TECHNOLOGY SERVICES,tới 30 triệu,,30000000.0,VND
2023-08-01,.Net Full-Stack Developer,Developer / Engineer,CÔNG TY TNHH AMARIS VIỆT NAM,thoả thuận,,,
2023-08-01,Tech Lead Làm Việc Tại Nghệ An ( Thu Nhập Upto 25M),Other,Công Ty Cổ Phần Công Nghệ ECRM,18 - 25 triệu,18000000.0,25000000.0,VND
2023-08-01,IT Business Analyst - HCM,Business / Analyst / Product,CÔNG TY TNHH AMARIS VIỆT NAM,thoả thuận,,,
2023-08-01,Scrum Master (Ecommerce Platform),Other,Công ty Cổ phần Thời Trang Yody,20 - 30 triệu,20000000.0,30000000.0,VND
2023-08-01,Business Analyst (Ba),Business / Analyst / Product,VUIHOC.vn,thoả thuận,,,
2023-08-01,Nhân Viên Data Admin (Thu Nhập Từ 7 - 8M),Developer / Engineer,CHI NHÁNH CÔNG TY CỔ PHẦN BÁNH KẸO Á CHÂU,7 - 8 triệu,7000000.0,8000000.0,VND
2023-08-01,Tester,Tester / QA,VUIHOC.vn,"tới 1,000 usd",,1000.0,USD
2023-08-01,Kỹ Thuật Viên Tại Trung Tâm Bảo Hành,IT Operations / DevOps / Support,CÔNG TY CỔ PHẦN THƯƠNG MẠI - DỊCH VỤ PHONG VŨ,7 - 8 triệu,7000000.0,8000000.0,VND
2023-08-01,Nhân Viên Hỗ Trợ Kỹ Thuật [Quận Long Biên-Hà Nội],IT Operations / DevOps / Support,Công ty Cổ phần Bán lẻ Kỹ thuật số FPT,7 - 10 triệu,7000000.0,10000000.0,VND
2023-08-01,Senior Game Client Developer (Unity/C),Developer / Engineer,CÔNG TY TNHH ONEUNIVERSE VN,thoả thuận,,,
2023-08-01,PHP Developer [HN],Developer / Engineer,CÔNG TY CỔ PHẦN ĐẦU TƯ VÀ CÔNG NGHỆ BAVAAN,thoả thuận,,,
2023-08-01,Chuyên Viên Kiểm Soát Quy Trình Phát Triển Phần Mềm (Pqa),Developer / Engineer,Công ty An ninh mạng Viettel- Chi nhánh Tập đoàn Công nghiệp- Viễn thông quân đội,20 - 40 triệu,20000000.0,40000000.0,VND
2023-08-01,Job .Net Developer [HN],Developer / Engineer,CÔNG TY CỔ PHẦN ĐẦU TƯ VÀ CÔNG NGHỆ BAVAAN,thoả thuận,,,
2023-08-01,Technical Support Engineer (Open For Fresher) Salary Upto 15M,Developer / Engineer,Công ty TNHH Insights.,8 - 15 triệu,8000000.0,15000000.0,VND
2023-08-01,Senior C Developer,Developer / Engineer,Công ty TNHH DZS Việt Nam,"tới 2,000 usd",,2000.0,USD
2023-08-01,Junior C Developer,Developer / Engineer,Công ty TNHH DZS Việt Nam,tới 750 usd,,750.0,USD
2023-08-01,Lập Trình Viên .Net/C# (Fresher 6 Tháng Kn- Lương 8-15Tr/Tháng),Developer / Engineer,Công ty Cổ phần đầu tư Công Nghệ và Thương Mại Softdreams,8 - 15 triệu,8000000.0,15000000.0,VND
2023-08-01,Kỹ Sư Lập Trình Nhúng (Up To 28M),Developer / Engineer,Công ty cổ phần công nghệ - viễn thông Elcom,tới 28 triệu,,28000000.0,VND
2023-08-01,Tester (Thu Nhập 15M - 25M),Tester / QA,CÔNG TY CỔ PHẦN TẬP ĐOÀN MEDIC GROUP,12 - 20 triệu,12000000.0,20000000.0,VND
2023-08-01,Senior Java Developer,Developer / Engineer,Công ty TNHH Hệ thống Thông Tin FPT,tới 30 triệu,,30000000.0,VND
2023-08-01,Android Developer (Kotlin/Java),Developer / Engineer,CÔNG TY CỔ PHẦN ĐẦU TƯ THƯƠNG MẠI QUỐC TẾ LIM,13 - 18 triệu,13000000.0,18000000.0,VND
2023-08-01,Fresher Mobile Developer (React Native),Developer / Engineer,CÔNG TY CỔ PHẦN ESTUARY,thoả thuận,,,
2023-08-01,PHP Laravel - From Mid. - Up To 2000K Usd,Developer / Engineer,Công ty Cổ phần Voyager,"1,000 - 2,000 usd",1000.0,2000.0,USD
2023-08-01,IT Developer,Developer / Engineer,SOLEMAX,thoả thuận,,,
2023-08-01,Nhân Viên Middle Sre/Devsecops (Aws),Developer / Engineer,CÔNG TY CỔ PHẦN GV ASIA,tới 30 triệu,,30000000.0,VND
2023-08-01,Nhân Viên IOS Developer (Swift),Developer / Engineer,CÔNG TY CỔ PHẦN GV ASIA,13 - 20 triệu,13000000.0,20000000.0,VND
2023-08-01,Thực Tập Sinh Nodejs,Developer / Engineer,Công ty Cổ phần Công nghệ Lifetek,thoả thuận,,,
2023-08-01,Iot Embedded Engineer (Offer Upto $2000),Developer / Engineer,Công Ty Cổ Phần Công Nghệ VMO Holdings,tới 50 triệu,,50000000.0,VND
2023-08-01,IT Manager (Microsoft-Based),Business / Analyst / Product,Công Ty Cổ Phần Công Nghệ VMO Holdings,"tới 1,500 usd",,1500.0,USD
2023-08-01,"Lập Trình Viên PHP Làm Việc Tại Quận 3, Tphcm",Developer / Engineer,WACONTRE ONE MEMBER LIMITED,trên 20 triệu,20000000.0,,VND
2023-08-01,Business Analyst,Business / Analyst / Product,CÔNG TY TNHH MTV AUSTRAX TECHNOLOGIES VIETNAM,25 - 40 triệu,25000000.0,40000000.0,VND
2023-08-01,Thực Tập Sinh IT Support (Fulltime),IT Operations / DevOps / Support,iAPP TECHASIANS,tới 3 triệu,,3000000.0,VND
2023-08-01,Thực Tập Sinh Business Analyst,Business / Analyst / Product,iAPP TECHASIANS,tới 2 triệu,,2000000.0,VND
2023-08-01,Business Analyst,Business / Analyst / Product,iAPP TECHASIANS,tới 20 triệu,,20000000.0,VND
2023-08-01,Intern Java,Developer / Engineer,iAPP TECHASIANS,tới 3 triệu,,3000000.0,VND
2023-08-01,Nhân Viên IT Support,IT Operations / DevOps / Support,CÔNG TY TNHH ARISTEEL,thoả thuận,,,
2023-08-01,Qt Embedded Engineers (Offer Upto $2000),Developer / Engineer,Công Ty Cổ Phần Công Nghệ VMO Holdings,tới 50 triệu,,50000000.0,VND
2023-08-01,Frontend Technical Lead,Developer / Engineer,Niteco,thoả thuận,,,
2023-08-01,.Net Technical Lead,Developer / Engineer,Niteco,thoả thuận,,,
2023-08-01,Node JS Developer Thu Nhập Upto 35 Triệu Đồng,Developer / Engineer,CÔNG TY TNHH PHẦN MỀM NK,thoả thuận,,,
2023-08-01,Front End Developer (Reactjs) - Hồ Chí Minh (Quận 2),Developer / Engineer,DISION TECH COMPANY LIMITED,thoả thuận,,,
2023-08-01,Nodejs Developer,Developer / Engineer,Công ty CP sáng tạo trẻ Việt Nam Miichisoft,20 - 30 triệu,20000000.0,30000000.0,VND
2023-08-01,Vuejs Developer,Developer / Engineer,Công ty CP sáng tạo trẻ Việt Nam Miichisoft,20 - 30 triệu,20000000.0,30000000.0,VND
2023-08-01,Technical Service Manager (Hybrid),Developer / Engineer,CÔNG TY TNHH LIVE GROUP VIỆT NAM,"tới 3,000 usd",,3000.0,USD
2023-08-01,IT Business Analyst (Hybrid),Business / Analyst / Product,CÔNG TY TNHH LIVE GROUP VIỆT NAM,"tới 2,000 usd",,2000.0,USD
2023-08-01,Junior Fullstack .Net Developer (Hybrid),Developer / Engineer,CÔNG TY TNHH LIVE GROUP VIỆT NAM,thoả thuận,,,
2023-08-01,Technical Writer (Hybrid),Developer / Engineer,CÔNG TY TNHH LIVE GROUP VIỆT NAM,"tới 1,300 usd",,1300.0,USD
2023-08-01,IT Helpdesk,IT Operations / DevOps / Support,Công ty TNHH Aeon Delight Việt Nam,thoả thuận,,,
2023-08-01,Chuyên Viên Kiểm Thử (Manual Tester),Tester / QA,Công ty Cổ phần Giải pháp Công nghệ TTC Việt Nam,17 - 22 triệu,17000000.0,22000000.0,VND
2023-08-01,"Junior UX/UI Designer - Thanh Xuân, Hà Nội (Thu Nhập Tới 15M)",Developer / Engineer,Công ty TNHH Volio Việt Nam,tới 15 triệu,,15000000.0,VND
2023-08-01,Junior Tester,Tester / QA,Công ty Cp Công nghệ và Truyền thông Dagoras,7 - 15 triệu,7000000.0,15000000.0,VND
2023-08-01,System Network Fresher - Quận 7 - Hồ Chí Minh,Developer / Engineer,Công Ty Cổ Phần VNETWORK,3 - 5 triệu,3000000.0,5000000.0,VND
2023-08-01,PHP Developer,Developer / Engineer,CÔNG TY TNHH GIANTY VIỆT NAM,thoả thuận,,,
2023-08-01,Kỹ Sư Quản Lý Chất Lượng CNTT (QA),Developer / Engineer,TẬP ĐOÀN CÔNG NGHIỆP - VIỄN THÔNG QUÂN ĐỘI,"700 - 1,500 usd",700.0,1500.0,USD
2023-08-01,Business Development Intern (Thị Trường Nhật Bản),Developer / Engineer,Công ty TNHH phần mềm Kaopiz,thoả thuận,,,
2023-08-01,Business Analysis (N2 Up),Business / Analyst / Product,FPT Software,thoả thuận,,,
2023-08-01,Project Manager (N1),Business / Analyst / Product,FPT Software,thoả thuận,,,
2023-08-01,Solution Architect_Salary Up To $4000,IT Operations / DevOps / Support,FPT Software,thoả thuận,,,
2023-08-01,Mobile Developer (Android/IOS),Developer / Engineer,Lampart,thoả thuận,,,
2023-08-01,Developer (PHP),Developer / Engineer,Lampart,thoả thuận,,,
2023-08-01,Project Manager_Salary Up To $3000,Business / Analyst / Product,FPT Software,thoả thuận,,,
2023-08-01,Bridge Software Engineer (.Net/Azure/Devops),Developer / Engineer,FPT Software,thoả thuận,,,
2023-08-01,Senior Account,Business / Analyst / Product,Công ty TNHH Giải pháp chuyển đổi số Việt Nam,tới 25 triệu,,25000000.0,VND
2023-08-01,Senior PHP,Developer / Engineer,Lampart,thoả thuận,,,
2023-08-01,Android Developer,Developer / Engineer,Công ty TNHH Tập Đoàn Đầu Tư Welly Corp,10 - 15 triệu,10000000.0,15000000.0,VND
2023-08-01,Nhân Viên Thiết Kế Website - Lương Cứng 10 -17 Triệu (UI/UX),Developer / Engineer,CÔNG TY TNHH TRUYỀN THÔNG MEDIA POWER,12 - 20 triệu,12000000.0,20000000.0,VND
2023-08-01,Senior Unity Engineer,Developer / Engineer,FPT Software,thoả thuận,,,
2023-08-01,"Nhân Viên Phát Triển Thị Trường B2B Hàn Quốc ( Từ 1 Năm Kinh Nghiệm, Tiếng Hàn Tốt ) Offer Upto",Other,Công Ty Cổ Phần Công Nghệ VMO Holdings,thoả thuận,,,
2023-08-01,Lập Trình Viên Full Stack,Developer / Engineer,Công ty Cổ phần Hợp tác BES,trên 10 triệu,10000000.0,,VND
2023-08-01,Devops Tại Hà Nội,Developer / Engineer,CÔNG TY CỔ PHẦN TRƯỜNG HỌC CÔNG NGHỆ MINDX,"trên 1,700 usd",1700.0,,USD
2023-08-01,Business Analyst (Software Detail Design Engineer),Developer / Engineer,Lampart,thoả thuận,,,
2023-08-01,Product Manager/Project Manager - Dự Án Giáo Dục.,Business / Analyst / Product,Công ty TNHH Hệ thống Thông Tin FPT,thoả thuận,,,
2023-08-01,Senior Software Tester,Tester / QA,Jolie Siam,20 - 35 triệu,20000000.0,35000000.0,VND
2023-08-01,Python Dev,Developer / Engineer,Công Ty Cổ Phần VCCorp,13 - 22 triệu,13000000.0,22000000.0,VND
2023-08-01,Nhân Viên IT,IT Operations / DevOps / Support,Công ty TNHH Nhất Nước,10 - 12 triệu,10000000.0,12000000.0,VND
2023-08-01,Security Engineer (Incident Response),Developer / Engineer,CÔNG TY TNHH AMARIS VIỆT NAM,thoả thuận,,,
2023-08-01,Security Engineer (Pentesting),Developer / Engineer,CÔNG TY TNHH AMARIS VIỆT NAM,thoả thuận,,,
2023-08-01,Python Developer (Có Nhận Fresher),Developer / Engineer,CÔNG TY CỔ PHẦN TCOM,tới 25 triệu,,25000000.0,VND
2023-08-01,Business Analyst (Up To 1800$),Business / Analyst / Product,Công ty TNHH Thu phí tự động VETC,"tới 1,800 usd",,1800.0,USD
2023-08-01,Full Stack Developer (Nodejs/Reactjs) - Senior,Developer / Engineer,Công ty TNHH Lisod Việt Nam,"tới 2,500 usd",,2500.0,USD
2023-08-01,Full Stack Developer (Senior),Developer / Engineer,Công ty TNHH Lisod Việt Nam,"tới 1,500 usd",,1500.0,USD
2023-08-01,Nhân Viên Kỹ Thuật Mạng,IT Operations / DevOps / Support,Công ty Cổ Phần Mũ Xanh,9 - 15 triệu,9000000.0,15000000.0,VND
2023-08-01,Thực Tập Sinh Kỹ Thuật Mạng,IT Operations / DevOps / Support,Công ty Cổ Phần Mũ Xanh,thoả thuận,,,
2023-08-01,IT Helpdesk Hỗ Trợ Kỹ Thuật Tại Hồ Chí Minh,IT Operations / DevOps / Support,CHI NHÁNH CÔNG TY TNHH THỂ THAO SPORT 1,8 - 10 triệu,8000000.0,10000000.0,VND
2023-08-01,Chuyên Viên Vận Hành Cloud (Ngành Công Nghệ Thông Tin - Thu Nhập Up To 60M),Developer / Engineer,Công ty cổ phần thương mại điện tử INET,30 - 60 triệu,30000000.0,60000000.0,VND
2023-08-01,Senior Front-End Developer,Developer / Engineer,CÔNG TY CỔ PHẦN CÔNG NGHỆ FLYER,tới 35 triệu,,35000000.0,VND
2023-08-01,React Native Developer Spoken English (Upto 40M),Developer / Engineer,Công ty Cổ Phần Rikkeisoft,tới 40 triệu,,40000000.0,VND
2023-08-01,Python Developer Spoken English (Upto 40M),Developer / Engineer,Công ty Cổ Phần Rikkeisoft,tới 40 triệu,,40000000.0,VND
2023-08-01,.Net Senior Developer,Developer / Engineer,CÔNG TY TNHH GITS,trên 20 triệu,20000000.0,,VND
2023-08-01,Chuyên Viên IT ERP/ Helpdesk,IT Operations / DevOps / Support,Công ty TNHH Đức Trung,9 - 11 triệu,9000000.0,11000000.0,VND
2023-08-01,UI/UX Designer,Developer / Engineer,CÔNG TY TNHH WAKESIZE,thoả thuận,,,
2023-08-01,Business Development,Developer / Engineer,CÔNG TY TNHH WAKESIZE,thoả thuận,,,
2023-08-01,24/7 .Net Developer,Developer / Engineer,Niteco,thoả thuận,,,
2023-08-01,IT Business Analyst (Finance/ Bank Experienced),Business / Analyst / Product,SHINHAN FINANCE,thoả thuận,,,
2023-08-01,Nhân Viên Giám Sát Camera,IT Operations / DevOps / Support,CÔNG TY TNHH THƯƠNG MAI AN CÁT- siêu thị K-Market,thoả thuận,,,
2023-08-01,Senior .Net Developers,Developer / Engineer,Niteco,thoả thuận,,,
2023-08-01,Technical Leader (Vuejs/Nodejs/Java/Fullstack),Developer / Engineer,CÔNG TY TNHH WAKESIZE,thoả thuận,,,
2023-08-01,Android Developers Biết Tiếng Trung,Developer / Engineer,Công ty cổ phần ANNA LEE GROUP,thoả thuận,,,
2023-08-01,Senior Business Analyst (Phân Tích Nghiệp Vụ) [Hà Nội],Business / Analyst / Product,CÔNG TY TNHH CÔNG NGHỆ NIW VIỆT NAM,tới 35 triệu,,35000000.0,VND
2023-08-01,Lập Trình Viên PHP,Developer / Engineer,Công ty Cổ phần Giáo dục & Đào tạo IMAP Việt Nam,15 - 25 triệu,15000000.0,25000000.0,VND
2023-08-01,Nhân Viên Kỹ Thuật Máy Tính - Máy In,IT Operations / DevOps / Support,công ty tnhh MTV Máy Tính Thuận Nhân,trên 10 triệu,10000000.0,,VND
2023-08-01,Tester Onsite,Tester / QA,Công ty cổ phần Ecoit,15 - 20 triệu,15000000.0,20000000.0,VND
2023-08-01,Solution Architect - Hà Nội,IT Operations / DevOps / Support,NGÂN HÀNG THƯƠNG MẠI CỔ PHẦN KỸ THƯƠNG VIỆT NAM,thoả thuận,,,
2023-08-01,Lập Trình Viên Backend PHP,Developer / Engineer,Công ty cổ phần công nghệ và dịch vụ Procare,8 - 20 triệu,8000000.0,20000000.0,VND
2023-08-01,Chuyên Viên Lập Trình - Mobile Dev,Developer / Engineer,Công ty Cổ phần Tin học - Viễn thông Hàng không,tới 15 triệu,,15000000.0,VND
2023-08-01,Data Engineer (Attractive Salary) - Top 1 Edtech Companies In Vietnam,Developer / Engineer,EDUPIA,tới 35 triệu,,35000000.0,VND
2023-08-01,PHP Developer,Developer / Engineer,CÔNG TY TNHH OUTCUBATOR VIỆT NAM,"800 - 2,000 usd",800.0,2000.0,USD
2023-08-01,IOS Developer,Developer / Engineer,CÔNG TY TNHH OUTCUBATOR VIỆT NAM,thoả thuận,,,
2023-08-01,React JS,Developer / Engineer,Công ty TNHH G&G Blockchain Camp,thoả thuận,,,
2023-08-01,Senior Business Analyst,Business / Analyst / Product,Woo Technology,"1,000 - 2,000 usd",1000.0,2000.0,USD
2023-08-01,Business Analyst,Business / Analyst / Product,Công ty cổ phần VH Edtech,thoả thuận,,,
2023-08-01,Chuyên Viên Vận Hành Cloud (Lương Upto 60Tr),IT Operations / DevOps / Support,Công ty cổ phần đầu tư thương mại xuất nhập khẩu Ngọc Đức,30 - 60 triệu,30000000.0,60000000.0,VND
2023-08-01,Nhân Viên Triển Khai Chuyển Giao Phần Mềm,Developer / Engineer,CÔNG TY CP TIN HỌC VÂN THANH,thoả thuận,,,
2023-08-01,Nhân Viên Lập Trình (Lương Cứng Từ 10 - 12 Triệu + Thưởng Dự Án),Developer / Engineer,Công ty TNHH Thiết bị & Công nghệ Phần mềm An Phát,10 - 15 triệu,10000000.0,15000000.0,VND
2023-08-01,Business Analyses For Product Team,Business / Analyst / Product,Công ty Cổ phần Eton,tới 30 triệu,,30000000.0,VND
2023-08-01,Thực Tập Sinh Business Analyst,Business / Analyst / Product,Top On Seek (TOS) Ltd.,trên 3 triệu,3000000.0,,VND
2023-08-01,IT Comtor Tiếng Nhật ( Từ 1 Năm Kinh Nghiệm),IT Operations / DevOps / Support,Công ty Cổ phần NTQ Solution,tới 25 triệu,,25000000.0,VND
2023-08-01,Thực Tập Sinh Lập Trình Viên JavaScript.,Developer / Engineer,Công ty Cổ phần Dịch vụ Truyền thông Đa phương tiện Việt Nam,thoả thuận,,,
2023-08-01,Thực Tập Sinh Lập Trình Viên PHP,Developer / Engineer,Công ty Cổ phần Dịch vụ Truyền thông Đa phương tiện Việt Nam,thoả thuận,,,
2023-08-01,Lập Trình Viên IOS 700$ - 1100$,Developer / Engineer,Công ty Cổ phần Phần mềm Deha,"700 - 1,100 usd",700.0,1100.0,USD
2023-08-01,Kỹ Sư Cầu Nối - Brigde Software Engineer,Developer / Engineer,Công ty TNHH Sản xuất phần mềm BAP,"1,000 - 3,000 usd",1000.0,3000.0,USD
2023-08-01,Lập Trình Viên Android 700$ - 1100$,Developer / Engineer,Công ty Cổ phần Phần mềm Deha,"700 - 1,100 usd",700.0,1100.0,USD
2023-08-01,Process QA For Hardware,Tester / QA,CÔNG TY TNHH EARABLE VIỆT NAM,20 - 30 triệu,20000000.0,30000000.0,VND
2023-08-01,"Business Analyst (2+ Năm Kinh Nghiệm, Topik 5 Trở Lên) - Onsite 3 Đến 6 Tháng Hàn Quốc - Lương Up To 35M Gross",Business / Analyst / Product,CÔNG TY CỔ PHẦN LOTUS TECHNOLOGY SERVICES,tới 35 triệu,,35000000.0,VND
2023-08-01,"Brse Engineer (2+ Năm Kinh Nghiệm, Topik 5 Trở Lên) - Onsite 3 Đến 6 Tháng Hàn Quốc_Lương Up To 35M Gross",Developer / Engineer,CÔNG TY CỔ PHẦN LOTUS TECHNOLOGY SERVICES,tới 35 triệu,,35000000.0,VND
2023-08-01,Business Analyst Lead (Firmware/Software Documentation),Business / Analyst / Product,CÔNG TY TNHH EARABLE VIỆT NAM,30 - 50 triệu,30000000.0,50000000.0,VND
2023-08-01,Process QA For Software,Tester / QA,CÔNG TY TNHH EARABLE VIỆT NAM,20 - 35 triệu,20000000.0,35000000.0,VND
2023-08-01,Middle Content Writer,IT Operations / DevOps / Support,Inspire Lab Technology,"tới 1,000 usd",,1000.0,USD
2023-08-01,Senior Flutter Mobile/ Lập Trình Viên Di Động Lĩnh Vực E-Learning (Up To 40M),Developer / Engineer,CÔNG TY TNHH FIVE-STAR E-LEARNING,tới 40 triệu,,40000000.0,VND
2023-08-01,Android Developer (Java/ Kotlin),Developer / Engineer,Công ty CPDV Trực tuyến Cộng Đồng Việt (VietUnion),tới 30 triệu,,30000000.0,VND
2023-08-01,Chuyên Viên Tester,Tester / QA,CÔNG TY TNHH ĐẦU TƯ GIÁO DỤC TRẠNG NGUYÊN,tới 18 triệu,,18000000.0,VND
2023-08-01,Security Solution Architect - Salary Up To $3000,IT Operations / DevOps / Support,FPT Software,thoả thuận,,,
2023-08-01,Android Developer,Developer / Engineer,CÔNG TY TNHH OUTCUBATOR VIỆT NAM,"tới 2,000 usd",,2000.0,USD
2023-08-01,Delivery Manager (N1/N2),Developer / Engineer,Công ty Cổ phần Tập đoàn Omi (OmiGroup),thoả thuận,,,
2023-08-01,Experience Business Analyst - Up To 40M,Business / Analyst / Product,Công Ty Cổ Phần VCCorp,20 - 40 triệu,20000000.0,40000000.0,VND
2023-08-01,"Lập Trình Viên Web (Html5, Css3, JavaScript, PHP)",Developer / Engineer,Công Ty Cổ Phần VCCorp,15 - 25 triệu,15000000.0,25000000.0,VND
2023-08-01,Lập Trình Viên IOS,Developer / Engineer,Công ty cổ phần ORA TECH JOINT STOCK COMPANY,"tới 1,200 usd",,1200.0,USD
2023-08-01,Nhân Viên IT,IT Operations / DevOps / Support,Công Ty TNHH MTV Phổ Đình,trên 8 triệu,8000000.0,,VND
2023-08-01,Fullstack Mobile Developer (Flutter + IOS/Android),Developer / Engineer,CÔNG TY CỔ PHẦN TVT GROUP,trên 16 triệu,16000000.0,,VND
2023-08-01,Fresher Fullstack Developer,Developer / Engineer,CÔNG TY TNHH CÔNG NGHỆ KVY,thoả thuận,,,
2023-08-01,Chuyên Viên IT Phần Mềm,Developer / Engineer,Công Ty Cổ Phần Đất Xanh Miền Trung,trên 12 triệu,12000000.0,,VND
2023-08-01,Kỹ Thuật Hệ Thống-System Engineer,Developer / Engineer,CÔNG TY CP TM DV VÙNG TRỜI THÔNG TIN,15 - 25 triệu,15000000.0,25000000.0,VND
2023-08-01,Backend Senior,Developer / Engineer,Công ty TNHH G&G Blockchain Camp,thoả thuận,,,
2023-08-01,Game Engineer (Unity),Developer / Engineer,CÔNG TY TNHH PLAYSTUDIOS VIỆT NAM,thoả thuận,,,
2023-08-01,PHP Developer (1200$ - 1800$),Developer / Engineer,Công ty TNHH G&G Blockchain Camp,"1,200 - 1,800 usd",1200.0,1800.0,USD
