2023-08-01,Kỹ Thuật Viên Tại Trung Tâm Bảo Hành Miền Bắc,IT Operations / DevOps / Support,CÔNG TY CỔ PHẦN THƯƠNG MẠI - DỊCH VỤ PHONG VŨ,7 - 8 triệu,7000000.0,8000000.0,VND
2023-08-01,Business Analyst (Japanese),Business / Analyst / Product,FPT Software,thoả thuận,,,
2023-08-01,Project Manager (Japanese),Business / Analyst / Product,FPT Software,thoả thuận,,,
2023-08-01,Backend Developer (Golang),Developer / Engineer,CÔNG TY CỔ PHẦN BSTAR SOLUTIONS,thoả thuận,,,
2023-08-01,Nhân Viên IT Helpdesk - Quận 12,IT Operations / DevOps / Support,CTCP Tập đoàn Thời trang Thái Tuấn,tới 9 triệu,,9000000.0,VND
2023-08-01,Fresher .Net Developer [HCM],Developer / Engineer,FPT Software,thoả thuận,,,
2023-08-01,Java Developer - Signing Bonus Up To 30M,Developer / Engineer,FPT Software,thoả thuận,,,
2023-08-01,Lập Trình PHP Laravel,Developer / Engineer,Công ty TNHH Tư Vấn Thương Mại Và Dịch Vụ CLICK,10 - 20 triệu,10000000.0,20000000.0,VND
2023-08-01,Nhân Viên Triển Khai Phần Mềm - Hà Nội - Bán Thời Gian,Developer / Engineer,Công ty Cổ phần Tekmedi,0.0 - 0.0 triệu,0.0,0.0,VND
2023-08-01,Middle Backend Engineer (Python),Developer / Engineer,Công ty An ninh mạng Viettel- Chi nhánh Tập đoàn Công nghiệp- Viễn thông quân đội,thoả thuận,,,
2023-08-01,Nhân Viên IT (Software),IT Operations / DevOps / Support,CÔNG TY TNHH CJ VINA AGRI,thoả thuận,,,
2023-08-01,QC Engineer,Developer / Engineer,Công ty Cổ phần Pizza 4Ps,thoả thuận,,,
2023-08-01,Chuyên Viên Triển Khai Cloud (Ngành Công Nghệ Thông Tin - Lương Upto 60M),Developer / Engineer,Công ty cổ phần thương mại điện tử INET,35 - 60 triệu,35000000.0,60000000.0,VND
2023-08-01,Java Developer/Tech Leader,Developer / Engineer,Công ty cổ phần Công nghệ VISSOFT,"tới 2,500 usd",,2500.0,USD
2023-08-01,Embedded C/C Developer,Developer / Engineer,Công ty cổ phần Công nghệ VISSOFT,10 - 35 triệu,10000000.0,35000000.0,VND
2023-08-01,Ruby On Rails (Offer Upto 2500$),Developer / Engineer,Công Ty Cổ Phần Công Nghệ VMO Holdings,"tới 2,500 usd",,2500.0,USD
2023-08-01,Chuyên Viên Triển Khai Cloud ( Ngành Công Nghệ Thông Tin - Lương Upto 60M),Developer / Engineer,Công ty cổ phần đầu tư thương mại xuất nhập khẩu Ngọc Đức,35 - 60 triệu,35000000.0,60000000.0,VND
2023-08-01,Nhân Viên IT (Biết Tiếng Anh) - Đồng Nai,IT Operations / DevOps / Support,CÔNG TY CỔ PHẦN ĐÚC CHÍNH XÁC C.Q.S MAY'S,thoả thuận,,,
2023-08-01,Nhân Viên Front - End,Developer / Engineer,Công ty cổ phần nền tảng công nghệ DONES,12 - 15 triệu,12000000.0,15000000.0,VND
2023-08-01,Nhân Viên Kỹ Thuật IT- Điện - Điện Tử [ Định Công - Hoàng Mai ] - Thu Nhập Lên Đến 15 Triệu,IT Operations / DevOps / Support,CÔNG TY CỔ PHẦN THƯƠNG MẠI VÀ CÔNG NGHỆ HÀ VIỆT,thoả thuận,,,
2023-08-01,Nhân Viên IT (Kỹ Sư Hệ Thống),Developer / Engineer,CÔNG TY TNHH GIẢI PHÁP DỮ LIỆU SÁNG TẠO,trên 20 triệu,20000000.0,,VND
2023-08-01,Lập Trình Viên Angular,Developer / Engineer,CÔNG TY CỔ PHẦN SMART - SOLUTIONS VIỆT NAM,"500 - 1,200 usd",500.0,1200.0,USD
2023-08-01,Lập Trình Viên Java,Developer / Engineer,CÔNG TY CỔ PHẦN SMART - SOLUTIONS VIỆT NAM,"500 - 1,200 usd",500.0,1200.0,USD
2023-08-01,Sever Backend Developer,Developer / Engineer,Ugotechs,10 - 27 triệu,10000000.0,27000000.0,VND
2023-08-01,Quality Assurance (QA),Tester / QA,CÔNG TY TÀI CHÍNH TRÁCH NHIỆM HỮU HẠN MB SHINSEI,tới 35 triệu,,35000000.0,VND
2023-08-01,Data Analyst,Developer / Engineer,CÔNG TY TÀI CHÍNH TRÁCH NHIỆM HỮU HẠN MB SHINSEI,tới 30 triệu,,30000000.0,VND
2023-08-01,Lập Trình Viên Web Full Stack (Junior),Developer / Engineer,Công ty Cổ Phần Symper Việt Nam,10 - 15 triệu,10000000.0,15000000.0,VND
2023-08-01,Manual Tester,Tester / QA,NashTech,thoả thuận,,,
2023-08-01,Senior Java Developer - Khoảng 6 Năm Kinh Nghiệm Trở Lên - Không Yêu Cầu Tiếng Anh - Lương Up To 40M Net,Developer / Engineer,CÔNG TY CỔ PHẦN LOTUS TECHNOLOGY SERVICES,tới 40 triệu,,40000000.0,VND
2023-08-01,Senior/Lead PHP Developer,Developer / Engineer,CÔNG TY TNHH RAKUS VIỆT NAM,"trên 1,700 usd",1700.0,,USD
2023-08-01,Java Tech Lead - Khoảng 6 Năm Kinh Nghiệm Code Java Trở Lên - Min 1 Năm Làm Team Lead - Không Yêu Cầu Tiếng Anh - Lương Up To 45M Net,Developer / Engineer,CÔNG TY CỔ PHẦN LOTUS TECHNOLOGY SERVICES,tới 45 triệu,,45000000.0,VND
2023-08-01,Manual Tester,Tester / QA,Mor Software HN,8 - 15 triệu,8000000.0,15000000.0,VND
2023-08-01,Senior Fullstack (English Fluent),Developer / Engineer,Công ty CP Phần mềm MOR,"tới 3,000 usd",,3000.0,USD
2023-08-01,Manual Tester,Tester / QA,Công ty CP Phần mềm MOR,tới 15 triệu,,15000000.0,VND
2023-08-01,Senior Fullstack Developer,Developer / Engineer,Công ty CP Phần mềm MOR,"tới 3,000 usd",,3000.0,USD
2023-08-01,Middle Frontend Developer,Developer / Engineer,CÔNG TY CỔ PHẦN QUỐC TẾ TDA VIỆT NAM,tới 35 triệu,,35000000.0,VND
2023-08-01,Lập Trình Viên Backend (Backend Developer),Developer / Engineer,Open Reach Tech Hanoi,30 - 35 triệu,30000000.0,35000000.0,VND
2023-08-01,"Business Analyst (Level: Middle, Senior) - Chuyên Viên Phân Tích Nghiệp Vụ",Business / Analyst / Product,TỔNG CÔNG TY CỔ PHẦN BƯU CHÍNH VIETTEL,25 - 45 triệu,25000000.0,45000000.0,VND
2023-08-01,SEO Team Leader,Other,CÔNG TY CỔ PHẦN CÔNG NGHỆ & THỂ THAO UNITY,20 - 45 triệu,20000000.0,45000000.0,VND
2023-08-01,Backend Developer Junior - Senior,Developer / Engineer,CÔNG TY CỔ PHẦN TẬP ĐOÀN HVN,10 - 30 triệu,10000000.0,30000000.0,VND
2023-08-01,Infra Engineer (On-Premise) Tại Hà Nội,Developer / Engineer,Công Ty TNHH LG CNS VIỆT NAM,thoả thuận,,,
2023-08-01,Nodejs Developer,Developer / Engineer,CÔNG TY TNHH PHẦN MỀM FPT,thoả thuận,,,
2023-08-01,Middle Strategic Planner,Other,Inspire Lab Technology,thoả thuận,,,
2023-08-01,Devops Engineer,Developer / Engineer,Công ty cổ phần Myceleb.vn,tới 20 triệu,,20000000.0,VND
2023-08-01,"Database Developer (Sql) Up To 2,000 Usd",Developer / Engineer,Nexcel Solutions,thoả thuận,,,
2023-08-01,Lập Trình Viên Front End - Angular - Từ 3 Năm Kinh Nghiệm,Developer / Engineer,CÔNG TY CỔ PHẦN DỊCH VỤ DI ĐỘNG THỂ HỆ MỚI (NMS),thoả thuận,,,
2023-08-01,Marketing Senior/Leader,Other,Công ty TNHH Beetsoft,tới 20 triệu,,20000000.0,VND
2023-08-01,Devops/Nestjs Developer (Aws/ Sql) - Upto $2000,Developer / Engineer,Công ty cổ phần IONAH,thoả thuận,,,
2023-08-01,"Thực Tập Sinh Thiết Kế Đồ Họa Game 2D (2D Game Artist) Trợ Cấp 3,5Tr/Tháng",Designer / Creative,CÔNG TY CỔ PHẦN CÔNG NGHỆ VÀ TRUYỀN THÔNG NETVIET,thoả thuận,,,
2023-08-01,"Thực Tập Sinh Designer Web, App Game - Trợ Cấp 3,5 Triệu/Tháng",Designer / Creative,CÔNG TY CỔ PHẦN CÔNG NGHỆ VÀ TRUYỀN THÔNG NETVIET,thoả thuận,,,
2023-08-01,"IOS Developers (Objective C, Swift)",Developer / Engineer,CÔNG TY CỔ PHẦN CÔNG NGHỆ VÀ TRUYỀN THÔNG NETVIET,15 - 40 triệu,15000000.0,40000000.0,VND
2023-08-01,Backend Engineer,Developer / Engineer,bePOS,tới 45 triệu,,45000000.0,VND
2023-08-01,Fresher Global Java Tại Đà Nẵng,Developer / Engineer,FPT Software,trên 8 triệu,8000000.0,,VND
2023-08-01,Bridge Software Engineer (N2 Up),Developer / Engineer,FPT Software,thoả thuận,,,
2023-08-01,Nhân Viên SEO Web,Other,CÔNG TY TRÁCH NHIỆM HỮU HẠN SẢN XUẤT THƯƠNG MẠI NỘI THẤT ĐẠI QUANG,8 - 10 triệu,8000000.0,10000000.0,VND
2023-08-01,Fresher C/C++ Tại Đà Nẵng,Other,FPT Software,tới 8 triệu,,8000000.0,VND
2023-08-01,Nhân Viên Digital Marketing (App/Game) - Thu Nhập Tới 30M,IT Operations / DevOps / Support,Công ty TNHH Volio Việt Nam,tới 30 triệu,,30000000.0,VND
2023-08-01,User Acquisition (App/Game) - Thu Nhập Tới 30M,IT Operations / DevOps / Support,Công ty TNHH Volio Việt Nam,tới 30 triệu,,30000000.0,VND
2023-08-01,"Senior Back-End Developer (Golang, Nodejs, PHP Laravel - Thu Nhập Tới 45M)",Developer / Engineer,Công ty TNHH Volio Việt Nam,thoả thuận,,,
2023-08-01,"2D Artist - Thanh Xuân, Hà Nội (Thu Nhập Tới 22M)",Designer / Creative,Công ty TNHH Volio Việt Nam,tới 22 triệu,,22000000.0,VND
2023-08-01,Nhân Viên Thiết Kế Kịch Bản Game (Thu Nhập Tới 20M),Other,Công ty TNHH Volio Việt Nam,thoả thuận,,,
2023-08-01,"Senior PHP Developer (Laravel, MySQL)",Developer / Engineer,Công ty CP Phần mềm MOR,thoả thuận,,,
2023-08-01,Nhân Viên Sáng Tạo Nội Dung Game - Game Designer (Up To 25 Triệu/Tháng),Designer / Creative,CÔNG TY TNHH CÔNG NGHỆ TAAP VIỆT NAM,5 - 25 triệu,5000000.0,25000000.0,VND
2023-08-01,AI Engineer,Developer / Engineer,Công ty Cổ phần DMSpro,thoả thuận,,,
2023-08-01,"Senior Android Developer (Java, Kotlin)",Developer / Engineer,CÔNG TY CỔ PHẦN EMDDI,thoả thuận,,,
2023-08-01,CTV Community Manager,IT Operations / DevOps / Support,Công ty TNHH phần mềm Kaopiz,thoả thuận,,,
2023-08-01,IOS Developer,Developer / Engineer,Công ty cổ phần Công nghệ Sapo,tới 35 triệu,,35000000.0,VND
2023-08-01,Nhân Viên IT Phần Mềm,Developer / Engineer,CÔNG TY TNHH MABUCHI MOTOR VIỆT NAM,thoả thuận,,,
2023-08-01,Data Scientist,Developer / Engineer,Công ty Cổ phần Thời Trang Yody,25 - 32 triệu,25000000.0,32000000.0,VND
2023-08-01,Java Developer (Ecommerce Platform),Developer / Engineer,Công ty Cổ phần Thời Trang Yody,18 - 35 triệu,18000000.0,35000000.0,VND
2023-08-01,Tester (Automation),Tester / QA,Công ty Cổ phần Thời Trang Yody,15 - 25 triệu,15000000.0,25000000.0,VND
2023-08-01,Java Web Developer,Developer / Engineer,CÔNG TY TNHH AMARIS VIỆT NAM,thoả thuận,,,
2023-08-01,Lập Trình Viên (Java/ JavaScript- Tiếng Nhật N3),Developer / Engineer,Công ty TNHH Phần mềm DTS Việt Nam,tới 15 triệu,,15000000.0,VND
2023-08-01,Mobile Apps React Native,Developer / Engineer,CTY CỔ PHẦN MYSPA,8 - 12 triệu,8000000.0,12000000.0,VND
2023-08-01,Senior IT Business Analyst,Business / Analyst / Product,CÔNG TY TNHH AMARIS VIỆT NAM,thoả thuận,,,
2023-08-01,Senior Backend Developer (Nodejs),Developer / Engineer,CÔNG TY TNHH GLEADS,"tới 1,800 usd",,1800.0,USD
2023-08-01,Scrum Master / Project Manager (Middle),Business / Analyst / Product,CÔNG TY TNHH AMARIS VIỆT NAM,thoả thuận,,,
2023-08-01,Data Analyst,Developer / Engineer,CÔNG TY TNHH MARATHON EDUCATION,600 - 800 usd,600.0,800.0,USD
2023-08-01,Android Dev Mobile App (Kotlin) Từng Có Kinh Nghiệm Ít Nhất 6 Tháng,Developer / Engineer,UmaxSoft,thoả thuận,,,
2023-08-01,"Trưởng Nhóm - Kỹ Sư CNTT, Chuyên Trách Camera Giám Sát Cctv",Developer / Engineer,Tổng công ty Công nghệ - Viễn thông Toàn cầu,20 - 30 triệu,20000000.0,30000000.0,VND
2023-08-01,Angular Developer (Middle/Senior),Developer / Engineer,CÔNG TY TNHH AMARIS VIỆT NAM,thoả thuận,,,
2023-08-01,Kỹ Sư CNTT - Chuyên Trách Camera Giám Sát Cctv,Developer / Engineer,Tổng công ty Công nghệ - Viễn thông Toàn cầu,tới 20 triệu,,20000000.0,VND
2023-08-01,Full-Stack Developer (Java-Angular),Developer / Engineer,CÔNG TY TNHH AMARIS VIỆT NAM,thoả thuận,,,
2023-08-01,Kỹ Sư Tích Hợp Hệ Thống (System Engineer),Developer / Engineer,Công ty cổ phần công nghệ - viễn thông Elcom,thoả thuận,,,
2023-08-01,UX/UI Designer (Fresher),Developer / Engineer,CÔNG TY TNHH BLUE DRAGON COMMUNICATIONS,7 - 9 triệu,7000000.0,9000000.0,VND
2023-08-01,Nhân Viên Lập Trình Mobile,Developer / Engineer,Công ty Cổ phần Blackwind,10 - 20 triệu,10000000.0,20000000.0,VND
2023-08-01,Trưởng Nhóm Lập Trình Web,Developer / Engineer,Công ty Cổ phần Blackwind,30 - 40 triệu,30000000.0,40000000.0,VND
2023-08-01,Senior Front-End Developer,Developer / Engineer,CÔNG TY TNHH TECH AVENUE SOLUTIONS VIỆT NAM,thoả thuận,,,
2023-08-01,Nhân Viên Phân Tích Nghiệp Vụ,Business / Analyst / Product,Công ty Cổ phần Blackwind,8 - 12 triệu,8000000.0,12000000.0,VND
2023-08-01,Nhân Viên Lập Trình Web,Developer / Engineer,Công ty Cổ phần Blackwind,10 - 20 triệu,10000000.0,20000000.0,VND
2023-08-01,Trưởng Bộ Phận Lập Trình Mobile,Developer / Engineer,Công ty Cổ phần Blackwind,30 - 40 triệu,30000000.0,40000000.0,VND
2023-08-01,System Admin,IT Operations / DevOps / Support,Công ty Cổ phần Blackwind,15 - 25 triệu,15000000.0,25000000.0,VND
2023-08-01,Nhân Viên Triển Khai Phần Mềm,Developer / Engineer,Công ty Cổ phần Blackwind,8 - 12 triệu,8000000.0,12000000.0,VND
2023-08-01,Nhân Viên Kiểm Thử Phần Mềm,Developer / Engineer,Công ty Cổ phần Blackwind,8 - 12 triệu,8000000.0,12000000.0,VND
2023-08-01,Lập Trình Viên Java Dự Án Banking,Developer / Engineer,Công ty Cổ phần Giải pháp Công nghệ TTC Việt Nam,18 - 25 triệu,18000000.0,25000000.0,VND
2023-08-01,"Lập Trình Data Engineer (Etl, Big Data)",Developer / Engineer,CÔNG TY CỔ PHẦN SMARTMOVE VIỆT NAM,12 - 20 triệu,12000000.0,20000000.0,VND
2023-08-01,.Net Developer | T11049,Developer / Engineer,Công ty TNHH CMC GLOBAL,20 - 60 triệu,20000000.0,60000000.0,VND
2023-08-01,QC Tester (Product - 4+ Years Of Experience),Tester / QA,CÔNG TY TNHH MEDIASTEP SOFTWARE VIỆT NAM,"tới 2,000 usd",,2000.0,USD
2023-08-01,Application Security,IT Operations / DevOps / Support,CÔNG TY CỔ PHẦN GIAO HÀNG TIẾT KIỆM,"tới 2,000 usd",,2000.0,USD
2023-08-01,Chuyên Viên Soc,Other,CÔNG TY CỔ PHẦN GIAO HÀNG TIẾT KIỆM,"tới 2,000 usd",,2000.0,USD
2023-08-01,Computer Vision Engineering,Developer / Engineer,CÔNG TY CỔ PHẦN GIAO HÀNG TIẾT KIỆM,"tới 1,500 usd",,1500.0,USD
2023-08-01,Junior Mobile Developer - Upto 1000$,Developer / Engineer,Công ty cổ phần phương tiện điện thông minh Selex,"tới 1,000 usd",,1000.0,USD
2023-08-01,Nhân Viên Phân Tích Nghiệp Vụ Phần Mềm (Ba),Developer / Engineer,Công ty Cổ phần Giải pháp Công nghệ Elsaga,thoả thuận,,,
2023-08-01,Backend Developer,Developer / Engineer,Công ty Cổ phần Giải pháp Công nghệ Elsaga,thoả thuận,,,
2023-08-01,Software Architect Senior,IT Operations / DevOps / Support,Trackify,tới 50 triệu,,50000000.0,VND
2023-08-01,HCM_Solution Architect - Salary Up To $3000,IT Operations / DevOps / Support,Công Ty Tnhh Giải Pháp Công Nghệ TPP,"tới 3,000 usd",,3000.0,USD
2023-08-01,HCM_Data Engineer,Developer / Engineer,Công Ty Tnhh Giải Pháp Công Nghệ TPP,"tới 2,300 usd",,2300.0,USD
2023-08-01,Business Intelligence Analyst (Up To 14M),Business / Analyst / Product,CÔNG TY CỔ PHẦN CÔNG NGHỆ THÔNG TIN HMD,tới 14 triệu,,14000000.0,VND
2023-08-01,Nhân Viên Kỹ Thuật Máy Tính,IT Operations / DevOps / Support,CÔNG TY CỔ PHẦN CÔNG NGHỆ PROTECH COMPUTER,7 - 15 triệu,7000000.0,15000000.0,VND
2023-08-01,IOS Developer,Developer / Engineer,CÔNG TY TNHH PHẦN MỀM FPT,thoả thuận,,,
2023-08-01,Tester/QC,Tester / QA,Công ty Cổ phần tập đoàn Công nghệ Thăng Long,10 - 15 triệu,10000000.0,15000000.0,VND
2023-08-01,Front-End Developer,Developer / Engineer,CÔNG TY TNHH PHẦN MỀM FPT,thoả thuận,,,
2023-08-01,Python Developer,Developer / Engineer,CÔNG TY TNHH PHẦN MỀM FPT,thoả thuận,,,
2023-08-01,Java Developer,Developer / Engineer,CÔNG TY TNHH PHẦN MỀM FPT,thoả thuận,,,
2023-08-01,Sitecore Developer,Developer / Engineer,CÔNG TY TNHH PHẦN MỀM FPT,thoả thuận,,,
2023-08-01,Embedded Software Engineer,Developer / Engineer,CÔNG TY TNHH PHẦN MỀM FPT,thoả thuận,,,
2023-08-01,Web Engineer (Vuejs/Reactjs Frontend Developer ),Developer / Engineer,SH SYSTEM,12 - 28 triệu,12000000.0,28000000.0,VND
2023-08-01,Web Engineer (PHP Backend Developer),Developer / Engineer,SH SYSTEM,12 - 38 triệu,12000000.0,38000000.0,VND
2023-08-01,Senior Android Developer,Developer / Engineer,IMT SOLUTIONS CORP,thoả thuận,,,
2023-08-01,"Lập Trình Viên Fullstack (Java, Angular)",Developer / Engineer,CÔNG TY TNHH GIẢI PHÁP CÔNG NGHỆ MIGI,tới 25 triệu,,25000000.0,VND
2023-08-01,Chuyên Viên Phát Triển Phần Mềm Front End,Developer / Engineer,Công ty Cổ phần Chứng khoán An Bình,thoả thuận,,,
2023-08-01,Senior Java Full Stack Developer,Developer / Engineer,CÔNG TY CỔ PHẦN ĐẦU TƯ VÀ CÔNG NGHỆ HEBELA,"tới 2,000 usd",,2000.0,USD
2023-08-01,Middle IOS Developer,Developer / Engineer,Viettel Software Services,tới 30 triệu,,30000000.0,VND
2023-08-01,Middle Android Developer,Developer / Engineer,Viettel Software Services,tới 30 triệu,,30000000.0,VND
2023-08-01,Unity Developer (Thực Tập Sinh Và Fresher) - Tại Cầu Giấy,Developer / Engineer,CÔNG TY TNHH PLAYCITY,3 - 15 triệu,3000000.0,15000000.0,VND
2023-08-01,Brse (Hybrid/Remote/Freelancer),Developer / Engineer,Công ty TNHH Yopaz,"tới 2,500 usd",,2500.0,USD
2023-08-01,Chuyên Viên An Toàn Bảo Mật Hệ Thống,IT Operations / DevOps / Support,BASE BUSINESS SOLUTIONS,18 - 22 triệu,18000000.0,22000000.0,VND
2023-08-01,Nhân Viên IT Helpdesk,IT Operations / DevOps / Support,CÔNG TY CỔ PHẦN ADAMO SOFTWARE,10 - 14 triệu,10000000.0,14000000.0,VND
2023-08-01,PHP Developer (Senior),Developer / Engineer,CÔNG TY TNHH HAPOSOFT,thoả thuận,,,
2023-08-01,Thực Tập Sinh IT Helpdesk,IT Operations / DevOps / Support,Công ty Cổ phần Eurowindow,thoả thuận,,,
2023-08-01,Lập Trình Viên .Net Dưới 01 Năm Kinh Nghiệm,Developer / Engineer,Công ty VTC Online,tới 16 triệu,,16000000.0,VND
2023-08-01,Lập Trình Viên .Net 03 Năm Kinh Nghiệm,Developer / Engineer,Công ty VTC Online,tới 26 triệu,,26000000.0,VND
2023-08-01,Trợ Lý Dự Án (Pa),Other,Công ty Cổ phần Công nghệ mạng và Truyền thông,9 - 13 triệu,9000000.0,13000000.0,VND
2023-08-01,"Microsoft Ax 2012, D365 Fo",Other,FPT Software,thoả thuận,,,
2023-08-01,Thực Tập Sinh Thiết Kế Website,IT Operations / DevOps / Support,CÔNG TY TNHH THƯƠNG MẠI VÀ DỊCH VỤ NINA,7 - 15 triệu,7000000.0,15000000.0,VND
2023-08-01,Kỹ Sư Truyền Dẫn Quang (Optical Network - Dwdm),Developer / Engineer,Công ty cổ phần công nghệ - viễn thông Elcom,thoả thuận,,,
2023-08-01,Nhân Viên Hỗ Trợ Kỹ Thuật Mạng IT (IT Helpdesk),IT Operations / DevOps / Support,CÔNG TY TNHH CÔNG NGHỆ VIỆT TUẤN,tới 10 triệu,,10000000.0,VND
2023-08-01,Manual Tester,Tester / QA,Convert Digital,thoả thuận,,,
2023-08-01,Embedded C/C++ Developer,Developer / Engineer,Công ty cổ phần công nghệ - viễn thông Elcom,"tới 1,200 usd",,1200.0,USD
2023-08-01,Nhân Viên IT Help Desk / IT Support,IT Operations / DevOps / Support,Công ty CP Viva Star coffee,trên 10 triệu,10000000.0,,VND
2023-08-01,Game Product Manager,Business / Analyst / Product,Công ty Cổ phần Funtap,thoả thuận,,,
2023-08-01,Sap Abap Developer_Signing Bonus Up To 40M,Developer / Engineer,FPT Software,thoả thuận,,,
2023-08-01,Android Embedded Software Development (Connectivity/Wireless),Developer / Engineer,Cty TNHH Thundersoft Việt Nam,thoả thuận,,,
2023-08-01,Project Manager,Business / Analyst / Product,Unit Corp,thoả thuận,,,
2023-08-01,Database Administrator (Dba),Developer / Engineer,CÔNG TY TNHH SAMSUNG SDS VIỆT NAM,thoả thuận,,,
2023-08-01,Business Analyst (Middle/Senior),Business / Analyst / Product,Unit Corp,thoả thuận,,,
2023-08-01,Backend Java Developer,Developer / Engineer,Công ty cổ phần Grooo International,"trên 1,000 usd",1000.0,,USD
2023-08-01,Thực Tập Sinh IT Helpdesk (IT Support),IT Operations / DevOps / Support,Bollore Logistics VN,thoả thuận,,,
2023-08-01,Blockchain Developer,Developer / Engineer,CÔNG TY TNHH THƯƠNG MẠI & DỊCH VỤ TECHNOLOGY ORBIT,"tới 2,500 usd",,2500.0,USD
2023-08-01,"Software Engineer (Fullstack, Senior)",Developer / Engineer,Tập đoàn FPT,thoả thuận,,,
2023-08-01,"Giám Sát An Toàn Thông Tin Soc Tier 3 (HN, HCM)",IT Operations / DevOps / Support,Công ty An ninh mạng Viettel- Chi nhánh Tập đoàn Công nghiệp- Viễn thông quân đội,thoả thuận,,,
2023-08-01,Pentester - HCM (Kỹ Sư Kiểm Thử Xâm Nhập),Developer / Engineer,Công ty An ninh mạng Viettel- Chi nhánh Tập đoàn Công nghiệp- Viễn thông quân đội,thoả thuận,,,
2023-08-01,Data Analyst 900-1200Usd,Developer / Engineer,LAWSON NETWORKS SOLUTION,"900 - 1,200 usd",900.0,1200.0,USD
2023-08-01,System Administrator IT Engineer,Developer / Engineer,Teamwork Vietnam,trên 13 triệu,13000000.0,,VND
2023-08-01,IT Helpdesk (Kinh Nghiệm Vận Hành Pos),IT Operations / DevOps / Support,Công ty TNHH MBC Playbe Việt Nam,thoả thuận,,,
2023-08-01,.Net Developer (Asp .Net Core),Developer / Engineer,CÔNG TY TNHH THƯƠNG MẠI & DỊCH VỤ TECHNOLOGY ORBIT,"800 - 2,500 usd",800.0,2500.0,USD
2023-08-01,Technical Leader,Developer / Engineer,CÔNG TY TNHH CAPICHI VIỆT NAM,thoả thuận,,,
2023-08-01,Thực Tập Sinh QC,Tester / QA,DXC Technology Vietnam,tới 5 triệu,,5000000.0,VND
2023-08-01,Junior Data Engineer,Developer / Engineer,Crossian,thoả thuận,,,
2023-08-01,Project Manager (Base Tech - Upto 55M),Business / Analyst / Product,Công ty Cổ Phần Rikkeisoft,tới 55 triệu,,55000000.0,VND
2023-08-01,Microsoft Cloud Support Specialist L3 - Salary Up To $2000,Other,FPT Software,thoả thuận,,,
2023-08-01,.Net Technical Lead - Salary Up To $3000,Developer / Engineer,FPT Software,thoả thuận,,,
2023-08-01,Senior System Analyst - Salary Up To $2500,Business / Analyst / Product,FPT Software,thoả thuận,,,
2023-08-01,IT Business Analyst (Middle/Senior),Business / Analyst / Product,CÔNG TY TNHH AMARIS VIỆT NAM,thoả thuận,,,
2023-08-01,Nhân Viên Content Marketing,Other,Công ty Cổ phần 24h Group,9 - 12 triệu,9000000.0,12000000.0,VND
2023-08-01,Lập Trình Viên IOS (Salary Upto 25M/Month),Developer / Engineer,Công Ty Cổ Phần Công Nghệ Android Việt Nam,tới 25 triệu,,25000000.0,VND
2023-08-01,"Mobile Developer (IOS, Android) [Hà Nội] - Yêu Cầu Tiếng Nhật N3, Lương Cơ Bản Upto $3000",Developer / Engineer,Công ty TNHH GMO-Z.com Financial System VN,"tới 3,000 usd",,3000.0,USD
2023-08-01,Lập Trình Java - Senior Developer,Developer / Engineer,Công ty cổ phần TechLead,thoả thuận,,,
2023-08-01,Lập Trình Viên IOS,Developer / Engineer,XGame,"tới 1,500 usd",,1500.0,USD
2023-08-01,IT Support,IT Operations / DevOps / Support,Alphanam Group,12 - 15 triệu,12000000.0,15000000.0,VND
2023-08-01,AI Enigneer,Developer / Engineer,CÔNG TY TNHH CLOUD ACE,thoả thuận,,,
2023-08-01,Nhân Viên IT Khu Vực Đà Lạt,IT Operations / DevOps / Support,Công Ty TNHH Môi Giới Bất Động Sản Sương Nguyệt Ánh,5 - 10 triệu,5000000.0,10000000.0,VND
2023-08-01,Powerbi/Looker Developer (Offer Upto $2000),Developer / Engineer,Công Ty Cổ Phần Công Nghệ VMO Holdings,35 - 45 triệu,35000000.0,45000000.0,VND
2023-08-01,Lập Trình Viên Web App - React JS Làm Việc Tại Nghệ An,Developer / Engineer,Công Ty Cổ Phần Công Nghệ ECRM,10 - 18 triệu,10000000.0,18000000.0,VND
2023-08-01,Information Systems Staff,IT Operations / DevOps / Support,Công ty TNHH hệ thống dây dẫn Sumi Việt Nam,trên 363 usd,363.0,,USD
2023-08-01,Chuyên Viên Quản Trị Cơ Sở Dữ Liệu (Csdl)/Senior Database Administrator,Developer / Engineer,NGÂN HÀNG THƯƠNG MẠI CỔ PHẦN VIỆT NAM THƯƠNG TÍN,12 - 25 triệu,12000000.0,25000000.0,VND
2023-08-01,Java Developer,Developer / Engineer,CÔNG TY TNHH MEDIASTEP SOFTWARE VIỆT NAM,"tới 2,000 usd",,2000.0,USD
2023-08-01,Nhân Viên Kỹ Thuật Hậu Kiểm,IT Operations / DevOps / Support,Công ty TNHH Thu phí tự động VETC,tới 8 triệu,,8000000.0,VND
2023-08-01,Nodejs Developer,Developer / Engineer,CÔNG TY TNHH THƯƠNG MẠI & DỊCH VỤ TECHNOLOGY ORBIT,"tới 1,500 usd",,1500.0,USD
2023-08-01,"Lập Trình Viên Front End Angular, Reactjs,Vuejs",Developer / Engineer,Công ty cổ phần Phenikaa-X,trên 15 triệu,15000000.0,,VND
2023-08-01,Nhân Viên Manual Tester (QA/QC Tester),Tester / QA,Công ty cổ phần công nghệ PosApp,10 - 14 triệu,10000000.0,14000000.0,VND
2023-08-01,"Senior Back End Dev (Nodejs, Python Or Golang)",Developer / Engineer,Công ty Cổ phần Appota,thoả thuận,,,
2023-08-01,Middle Front End Dev (Reactjs),Developer / Engineer,Công ty Cổ phần Appota,thoả thuận,,,
2023-08-01,Java Developer Intern/Fresher (Làm Việc Tại HCM),Developer / Engineer,CÔNG TY TNHH CÔNG NGHỆ ALTEK,thoả thuận,,,
2023-08-01,Java Developer (Cao Lãnh),Developer / Engineer,CÔNG TY TNHH CÔNG NGHỆ ALTEK,thoả thuận,,,
2023-08-01,Mobile Developer (Android/IOS/Cao Lãnh),Developer / Engineer,CÔNG TY TNHH CÔNG NGHỆ ALTEK,thoả thuận,,,
2023-08-01,Kỹ Sư Mạng & Bảo Mật (Network Engineer),Developer / Engineer,Công ty TNHH Công nghệ số NGS,tới 40 triệu,,40000000.0,VND
2023-08-01,Manual Tester (Cao Lãnh),Tester / QA,CÔNG TY TNHH CÔNG NGHỆ ALTEK,thoả thuận,,,
2023-08-01,.Net Developer (C#),Developer / Engineer,CÔNG TY TNHH STEPMEDIA SOFTWARE VIỆT NAM,"tới 2,200 usd",,2200.0,USD
2023-08-01,Middle Fullstack,Developer / Engineer,Công ty TNHH Medring Vietnam International,20 - 30 triệu,20000000.0,30000000.0,VND
